{
  "$schema": "https://json-schema.org/draft/2020-12/schema",
  "$id": "https://theowlsh.dev/schema/owlsh-report-1.0.json",
  "title": "owlsh Session Report",
  "description": "The schema-versioned JSON document that every owlsh backend module produces and the report UI consumes. This is the same blob embedded in the portable HTML export (brief §6.3, <script id=\"owlsh-data\">) and the unit the Enterprise Bridge signs.",
  "type": "object",
  "required": ["schema_version", "session", "episodes", "phases", "golden_dag", "metrics", "coaching", "redaction_profile"],
  "additionalProperties": false,
  "properties": {
    "schema_version": { "enum": ["1.0", "1.1", "1.2", "1.3", "1.4"] },

    "session": {
      "type": "object",
      "required": ["uuid", "started_at", "ended_at", "target_scope", "shell", "source"],
      "additionalProperties": false,
      "properties": {
        "uuid": { "type": "string", "format": "uuid" },
        "started_at": { "type": "string", "format": "date-time" },
        "ended_at": { "type": "string", "format": "date-time" },
        "target_scope": { "type": "string", "description": "Authorized scope, e.g. an HTB box label or CIDR." },
        "context_path": { "type": "string", "description": "host -> vm -> container provenance, e.g. cloud:htb:pwnbox." },
        "shell": { "type": "string" },
        "source": { "type": "string", "enum": ["local_pty", "in_vm_daemon", "plugin"] },
        "machine": {
          "type": "object",
          "description": "Lab/machine identity, surfaced as the report's hero (e.g. the HTB box named via --machine on capture).",
          "additionalProperties": false,
          "properties": {
            "name": { "type": "string" },
            "slug": { "type": "string" },
            "os": { "type": "string" },
            "difficulty": { "type": "string", "enum": ["Easy", "Medium", "Hard", "Insane"] },
            "avatar": { "type": ["string", "null"], "description": "Avatar URL (e.g. HTB CDN); fetched at render with a generated fallback." },
            "points": { "type": ["integer", "null"] },
            "retired": { "type": "boolean" }
          }
        },
        "target": {
          "type": "object",
          "description": "Neutral, platform-agnostic target identity (schema v1.2). Supersedes session.machine; machine is retained for back-compat.",
          "additionalProperties": false,
          "properties": {
            "platform": { "type": "string", "enum": ["htb", "thm", "offsec", "immersive", "local", "breachyard"] },
            "kind": { "type": "string" },
            "name": { "type": "string" },
            "slug": { "type": "string" },
            "os": { "type": "string" },
            "difficulty": {
              "type": ["object", "null"],
              "additionalProperties": false,
              "properties": {
                "level": { "type": "integer", "minimum": 1, "maximum": 5 },
                "label": { "type": "string" }
              }
            },
            "emblem": {
              "type": "object",
              "additionalProperties": false,
              "properties": {
                "avatar": { "type": ["string", "null"] },
                "hue": { "type": ["integer", "null"], "minimum": 0, "maximum": 360 }
              }
            },
            "url": { "type": ["string", "null"] }
          }
        }
      }
    },

    "episodes": {
      "type": "array",
      "description": "The ~40 compressed episode cards (brief §4.1). One machine_bound command is one atomic card.",
      "items": {
        "type": "object",
        "required": ["seq", "cmd", "binary", "duration_ms", "gap_before_ms", "actor", "tactic"],
        "additionalProperties": false,
        "properties": {
          "seq": { "type": "integer", "minimum": 0 },
          "cmd": { "type": "string", "description": "Redacted command text. Empty for a pure think_pause episode." },
          "binary": { "type": "string", "description": "Primary binary, e.g. nmap, gobuster, sudo. Empty for think_pause." },
          "started_at_ms": { "type": "integer", "minimum": 0, "description": "Absolute wall-clock start (epoch ms). Enables merge-sorting concurrent capture lanes into a single engagement timeline (schema v1.2)." },
          "duration_ms": { "type": "integer", "minimum": 0, "description": "Machine working time." },
          "gap_before_ms": { "type": "integer", "minimum": 0, "description": "Human thinking time before this episode." },
          "exit_code": { "type": ["integer", "null"] },
          "actor": { "type": "string", "enum": ["machine_bound", "human_active", "think_pause", "idle"] },
          "output_digest": { "type": "string", "description": "Compact, LLM-friendly summary of output (never raw bytes)." },
          "tactic": { "type": "string", "description": "MITRE ATT&CK tactic id, e.g. TA0007.", "pattern": "^TA[0-9]{4}$" },
          "technique": { "type": "string", "description": "MITRE technique id, e.g. T1046.", "pattern": "^T[0-9]{4}(\\.[0-9]{3})?$" },
          "confidence": { "type": "number", "minimum": 0, "maximum": 1 },
          "noise_weight": { "type": "number", "minimum": 0, "maximum": 10, "description": "1 = quiet/manual, 10 = hydra brute force (brief §6.1)." },
          "volume": { "type": "integer", "minimum": 0, "description": "Request/line count that scales the noise weight." },
          "context_path": { "type": "string" },
          "alignment": {
            "type": ["string", "null"],
            "enum": ["match", "alternative", "detour", "skipped", "out_of_order", null],
            "description": "Result of Needleman-Wunsch alignment vs the golden DAG (brief §4.3)."
          },
          "loop_of_seq": {
            "type": ["integer", "null"],
            "description": "If set, this episode is a redundant near-duplicate retry of the referenced seq (Loop waste, brief §6.1)."
          },
          "frameworks": {
            "type": "object",
            "description": "Cross-framework overlay on the ATT&CK classification (schema v1.1): UKC phase + CWE weakness class.",
            "additionalProperties": false,
            "properties": {
              "ukc": {
                "type": "string",
                "description": "Unified Kill Chain phase derived from the ATT&CK tactic — adds attack ordering.",
                "enum": ["reconnaissance", "exploitation", "execution", "persistence", "defense-evasion", "credential-access", "privilege-escalation", "lateral-movement", "command-and-control", "collection", "exfiltration", "objectives"]
              },
              "cwe": { "type": "array", "items": { "type": "string", "pattern": "^CWE-[0-9]+$" }, "description": "Distinct CWE weakness classes the episode exploited." }
            }
          }
        }
      }
    },

    "phases": {
      "type": "array",
      "description": "Confidence-weighted MITRE phase map. Phases are not a clean partition; engagements loop.",
      "items": {
        "type": "object",
        "required": ["mitre_tactic", "label", "started_at", "ended_at", "efficiency_pct"],
        "additionalProperties": false,
        "properties": {
          "mitre_tactic": { "type": "string", "pattern": "^TA[0-9]{4}$" },
          "label": { "type": "string" },
          "started_at": { "type": "string", "format": "date-time" },
          "ended_at": { "type": "string", "format": "date-time" },
          "efficiency_pct": { "type": "number", "minimum": 0, "maximum": 100 }
        }
      }
    },

    "golden_dag": {
      "type": "array",
      "description": "The seeded write-up parsed into tool-agnostic objectives (brief §4.3). A DAG, not a list.",
      "items": {
        "type": "object",
        "required": ["objective", "tactic", "satisfied_by"],
        "additionalProperties": false,
        "properties": {
          "objective": { "type": "string" },
          "tactic": { "type": "string", "pattern": "^TA[0-9]{4}$" },
          "satisfied_by": { "type": "array", "items": { "type": "string" }, "description": "Tools/methods that satisfy this objective." },
          "techniques": { "type": "array", "items": { "type": "string" }, "description": "ATT&CK techniques that also satisfy this objective (technique-keyed, for web/EDR objectives)." },
          "depends_on": { "type": "array", "items": { "type": "string" }, "description": "Objective ids that are true prerequisites." },
          "user_satisfied_by_seq": { "type": ["integer", "null"], "description": "Episode seq that satisfied this objective, or null if skipped." },
          "status": { "type": "string", "enum": ["untouched", "attempted", "reached", "proven"] },
          "finding_refs": { "type": "array", "items": { "type": "string" } },
          "proven_by_seq": { "type": ["integer", "null"] }
        }
      }
    },

    "metrics": {
      "type": "object",
      "required": ["efficiency_pct", "time_waster", "stealth_score", "objective_coverage_pct", "technique_breadth"],
      "additionalProperties": false,
      "properties": {
        "efficiency_pct": { "type": "number", "minimum": 0, "maximum": 100 },
        "time_waster": {
          "type": "object",
          "required": ["productive_ms", "detour_ms", "stuck_ms", "loop_ms", "t_active_ms"],
          "additionalProperties": false,
          "properties": {
            "productive_ms": { "type": "integer", "minimum": 0 },
            "detour_ms": { "type": "integer", "minimum": 0 },
            "stuck_ms": { "type": "integer", "minimum": 0 },
            "loop_ms": { "type": "integer", "minimum": 0 },
            "t_active_ms": { "type": "integer", "minimum": 0 }
          }
        },
        "stealth_score": { "type": "number", "minimum": 0, "maximum": 100 },
        "loud_moments": {
          "type": "array",
          "items": {
            "type": "object",
            "required": ["seq", "noise"],
            "additionalProperties": false,
            "properties": {
              "seq": { "type": "integer" },
              "noise": { "type": "number", "minimum": 0 }
            }
          }
        },
        "independence": {
          "type": "object",
          "description": "Enterprise signal — routed to a human, never an automated verdict (brief §6.4).",
          "required": ["score", "signals"],
          "additionalProperties": false,
          "properties": {
            "score": { "type": "number", "minimum": 0, "maximum": 100 },
            "signals": {
              "type": "object",
              "additionalProperties": false,
              "properties": {
                "think_pause_presence": { "type": "number" },
                "typo_entropy": { "type": "number" },
                "paste_burst_ratio": { "type": "number" },
                "cohort_uniqueness": { "type": "number" }
              }
            }
          }
        },
        "objective_coverage_pct": { "type": "number", "minimum": 0, "maximum": 100 },
        "technique_breadth": { "type": "integer", "minimum": 0, "description": "Count of distinct MITRE techniques touched." },
        "ukc_coverage_pct": { "type": "number", "minimum": 0, "maximum": 100, "description": "Distinct UKC phases reached vs. those the intended path requires (schema v1.1)." },
        "ukc_progression": { "type": "number", "minimum": 0, "maximum": 100, "description": "Share of UKC-phase transitions that advance rather than backtrack (schema v1.1)." },
        "weakness_breadth": { "type": "integer", "minimum": 0, "description": "Count of distinct CWE weakness classes exploited (schema v1.1)." },
        "methodology_coverage_pct": { "type": "number", "minimum": 0, "maximum": 100, "description": "Share of the expected methodology checklist actually touched (schema v1.3)." },
        "focus_discipline_pct": { "type": "number", "minimum": 0, "maximum": 100, "description": "Share of active time spent on-path vs. detours (schema v1.3)." },
        "recovery_median_ms": { "type": ["integer", "null"], "minimum": 0, "description": "Median time to recover from a stuck/loop episode (schema v1.3)." },
        "ghost_time_lost_ms": { "type": ["integer", "null"], "minimum": 0, "description": "Headline copy of ghost.time_lost_ms for the summary card (schema v1.4)." },
        "ghost_human_wins": { "type": ["integer", "null"], "minimum": 0, "description": "Headline copy of ghost.human_wins for the summary card (schema v1.4)." }
      }
    },

    "coaching": {
      "type": "object",
      "required": ["skill_radar", "next_steps"],
      "additionalProperties": false,
      "properties": {
        "skill_radar": {
          "type": "object",
          "required": ["recon", "web", "exploit", "privesc", "opsec"],
          "additionalProperties": false,
          "properties": {
            "recon": { "type": "number", "minimum": 0, "maximum": 100 },
            "web": { "type": "number", "minimum": 0, "maximum": 100 },
            "exploit": { "type": "number", "minimum": 0, "maximum": 100 },
            "privesc": { "type": "number", "minimum": 0, "maximum": 100 },
            "opsec": { "type": "number", "minimum": 0, "maximum": 100 }
          }
        },
        "next_steps": {
          "type": "array",
          "items": {
            "type": "object",
            "required": ["action", "why", "category"],
            "additionalProperties": false,
            "properties": {
              "action": { "type": "string", "description": "The imperative lead — what to do next time (markdown)." },
              "why": { "type": "string", "description": "The rationale, grounded in this run (markdown)." },
              "category": { "type": "string", "enum": ["Recon", "Web", "Access", "PrivEsc", "OpSec", "Tactics", "Recap"] },
              "evidence_seq": { "type": ["integer", "null"], "description": "The captured step this advice points at, for deep-linking." }
            }
          }
        }
      }
    },

    "replay": {
      "type": "object",
      "additionalProperties": false,
      "properties": {
        "cast_ref": { "type": ["string", "null"], "description": "External asciinema cast path (lite export)." },
        "inline_cast": { "type": ["string", "null"], "description": "Inlined asciinema v2 cast (full export)." }
      }
    },

    "redaction_profile": {
      "type": "string",
      "enum": ["public_safe", "full"],
      "description": "public_safe strips active IPs, hostnames, flags, anything credential-adjacent (brief §6.3)."
    },

    "recording": {
      "type": "boolean",
      "description": "True while the session is live (machine spawned, capture ongoing); the daemon flips it false on session end."
    },

    "noise_baseline": {
      "type": "object",
      "description": "Per-box loudness anchor: the noise of a 'loud reference solve'. Σ noise here = stealth 0. Derived per box from its expected loud tooling, not a global constant — so 0–100 means something per box.",
      "required": ["total", "reference"],
      "additionalProperties": false,
      "properties": {
        "total": { "type": "number", "minimum": 0, "description": "Sum of the reference noise — the stealth-0 denominator." },
        "reference": {
          "type": "array",
          "description": "The loud reference solve, broken down so the baseline is inspectable.",
          "items": {
            "type": "object",
            "required": ["label", "noise"],
            "additionalProperties": false,
            "properties": {
              "label": { "type": "string", "description": "The loud action, e.g. 'hydra http-form (rockyou)'." },
              "noise": { "type": "number", "minimum": 0, "description": "Its noise = weight × (1 + log10(volume))." }
            }
          }
        }
      }
    },

    "findings": {
      "type": "array",
      "description": "Platform-agnostic evidence entries (ports, creds, flags, etc.) extracted from episodes, cross-referenced by golden_dag objectives (schema v1.2).",
      "items": {
        "type": "object",
        "required": ["id", "kind", "value", "source_seq"],
        "additionalProperties": false,
        "properties": {
          "id": { "type": "string" },
          "kind": { "type": "string", "enum": ["port", "service", "version", "cred", "url", "path", "host", "hash", "vuln", "flag"] },
          "value": { "type": "string" },
          "masked": { "type": "boolean" },
          "source_seq": { "type": "integer", "minimum": 0 },
          "used_by_seq": { "type": "array", "items": { "type": "integer", "minimum": 0 } },
          "tactic": { "type": "string", "pattern": "^TA[0-9]{4}$" },
          "proven": { "type": "boolean" },
          "confidence": { "type": "number", "minimum": 0, "maximum": 1 }
        }
      }
    },

    "hints": {
      "type": "array",
      "description": "Opt-in hint pulls from the live widget. Each pull lowers the independence component of the grade.",
      "items": {
        "type": "object",
        "required": ["tier", "atMs", "phase"],
        "additionalProperties": false,
        "properties": {
          "tier": { "type": "integer", "enum": [1, 2, 3] },
          "atMs": { "type": "number", "minimum": 0 },
          "phase": { "type": "string" },
          "source": { "type": "string", "enum": ["static", "ai:golden", "ai:knowledge"] }
        }
      }
    },

    "hint_golden": {
      "type": "object",
      "description": "Golden path resolved for live hints (the .golden sidecar). source 'none' caches a failed lookup.",
      "properties": {
        "source": { "type": "string" },
        "confidence": { "type": "number" },
        "golden": { "type": "array", "items": { "type": "object" } }
      }
    },

    "ghost": {
      "type": "object",
      "description": "Counterfactual 'optimal-from-your-state' analysis (schema v1.4). Deterministic; never feeds the grade.",
      "additionalProperties": false,
      "properties": {
        "time_lost_ms": { "type": "integer", "minimum": 0, "description": "Σ late-pivot lag (time between a finding-unlock and your action)." },
        "human_wins": { "type": "integer", "minimum": 0, "description": "Count of ahead / off-path moments where the human beat the optimal line." },
        "items": {
          "type": "array",
          "items": {
            "type": "object",
            "required": ["objective", "verdict"],
            "additionalProperties": false,
            "properties": {
              "objective": { "type": "string" },
              "verdict": { "type": "string", "enum": ["on_time", "late_pivot", "skipped", "ahead", "off_path_win"] },
              "unlock_seq": { "type": ["integer", "null"], "description": "Earliest episode seq where prerequisite findings existed." },
              "actual_seq": { "type": ["integer", "null"], "description": "Episode seq that satisfied it, or null." },
              "lag_ms": { "type": "integer", "minimum": 0, "description": "Time between unlock and your action (0 for on_time/ahead)." },
              "note": { "type": "string", "description": "Optional model narration; deterministic hint when absent." }
            }
          }
        }
      }
    }
  }
}
